{"schemaVersion":1,"kind":"final_reviewability_gate","status":"proceed","outcome":"marker_split","mode":"final","gate_result":"block","gate_reason":"total files 90 exceeds block threshold 25","metrics":{"reviewable_loc":0,"production_files":0,"total_files":90,"primary_surface_count":5,"primary_surfaces":["docs/process","other","scheduler/runtime","schema/migration","seed/config"],"greenfield":false,"thresholds":{"warn":{"reviewable_loc":400,"production_files":6,"total_files":15,"primary_surfaces":1},"block":{"reviewable_loc":800,"production_files":8,"total_files":25,"primary_surfaces":1}},"warnings":["total files 90 exceeds warn threshold 15","primary surfaces 5 exceeds warn threshold 1"],"blockers":["total files 90 exceeds block threshold 25"]},"exception":{"honored":false,"class":null,"evidence":[]},"blocked_operations":[],"timestamp":"2026-06-14T03:45:58Z","pr_created":false,"pr":null,"reslicing_packet_path":null,"marker_split_evidence_path":"specs/prsg-014-optional-gh-stack-stack-manager-integration/.process/marker-plan/final-marker-split-result.json","full_diff":{"reviewability_status":"block","gate_exit_code":1,"reason":"total files 90 exceeds block threshold 25","metrics":{"reviewable_loc":0,"production_files":0,"total_files":90,"primary_surface_count":5,"primary_surfaces":["docs/process","other","scheduler/runtime","schema/migration","seed/config"],"greenfield":false,"thresholds":{"warn":{"reviewable_loc":400,"production_files":6,"total_files":15,"primary_surfaces":1},"block":{"reviewable_loc":800,"production_files":8,"total_files":25,"primary_surfaces":1}},"warnings":["total files 90 exceeds warn threshold 15","primary surfaces 5 exceeds warn threshold 1"],"blockers":["total files 90 exceeds block threshold 25"]},"evidence_path":"/var/folders/jp/nt5kjq_11m3fvxg9ftwjjqsw0000gn/T//final-reviewability-gate.3o2fKi"},"marker_plan":{"valid":true,"fingerprint_matched":true,"marker_count":5,"marker_order":["foundation","us1","us2","us3","us4"],"status":"emission_ready","evidence_path":"specs/prsg-014-optional-gh-stack-stack-manager-integration/.process/marker-plan/pr-marker-plan.json","source_fingerprint":{"feature_spec_sha":"5c9359619422b69e5cbd70f3c3685b9fbc601692fff4f8f1847005c0029f9dbc","plan_declared_scope_sha":"574e4f821423a2a3104d61ef95cfc71cb639ed38541209ad827b79763aa2bf72","tasks_sha":"adf68363687ec2a82747fc6c8ab3a22e18ffda38d776e33aec5e3b368afa5e53","reviewability_sha":"6ad5b3da8f1ad4d31a9784e42ecd8f3c38a8a4806297fc07c896e39f45938765","hazard_route_sha":"feaf8803f3d53fbc661e5b4bf2d7f16c5a106ef585827531a363edc5c0aab52a"}},"emission":{"route":"marker_split","markers":[{"id":"foundation","review_order":1,"source_marker_ids":["foundation"],"packet_path":null,"declared_files":[{"operation":"MODIFIED","path":"speckit-pro/skills/speckit-autopilot/contracts/multi-pr-emission-state.schema.json"},{"operation":"MODIFIED","path":"speckit-pro/skills/speckit-autopilot/contracts/prs-v2.schema.json"},{"operation":"MODIFIED","path":"speckit-pro/skills/speckit-autopilot/contracts/restack-output.schema.json"},{"operation":"MODIFIED","path":"speckit-pro/skills/speckit-autopilot/contracts/stack-manager-decision.schema.json"},{"operation":"MODIFIED","path":"speckit-pro/skills/speckit-autopilot/scripts/detect-stack-manager.sh"},{"operation":"MODIFIED","path":"specs/prsg-014-optional-gh-stack-stack-manager-integration/plan.md"}],"declared_tests":["tests/speckit-pro/layer4-scripts/fixtures/stack-manager/README.md","tests/speckit-pro/layer4-scripts/fixtures/stack-manager/expected/decision-supported.json","tests/speckit-pro/layer4-scripts/fixtures/stack-manager/schema/stack-manager-decision-cases.json","tests/speckit-pro/layer4-scripts/fixtures/stack-manager/topology/prsg-014-prs.json","tests/speckit-pro/layer4-scripts/test-detect-stack-manager.sh"],"warnings":[]},{"id":"us1","review_order":2,"source_marker_ids":["us1"],"packet_path":null,"declared_files":[{"operation":"MODIFIED","path":"speckit-pro/skills/speckit-autopilot/scripts/detect-stack-manager.sh"}],"declared_tests":["tests/speckit-pro/layer4-scripts/fixtures/stack-manager/cases/detection-matrix.json","tests/speckit-pro/layer4-scripts/test-detect-stack-manager.sh"],"warnings":[]},{"id":"us2","review_order":3,"source_marker_ids":["us2"],"packet_path":null,"declared_files":[{"operation":"MODIFIED","path":"speckit-pro/skills/speckit-autopilot/scripts/multi-pr-emission.sh"}],"declared_tests":["tests/speckit-pro/layer4-scripts/test-multi-pr-emission.sh"],"warnings":[]},{"id":"us3","review_order":4,"source_marker_ids":["us3"],"packet_path":null,"declared_files":[{"operation":"MODIFIED","path":"speckit-pro/skills/speckit-autopilot/scripts/restack.sh"}],"declared_tests":["tests/speckit-pro/layer4-scripts/test-restack.sh"],"warnings":[]},{"id":"us4","review_order":5,"source_marker_ids":["us4"],"packet_path":null,"declared_files":[{"operation":"MODIFIED","path":"speckit-pro/codex-skills/speckit-autopilot/SKILL.md"},{"operation":"MODIFIED","path":"speckit-pro/skills/speckit-autopilot/references/post-implementation.md"},{"operation":"MODIFIED","path":"specs/prsg-014-optional-gh-stack-stack-manager-integration/.process/pr-packet.md"}],"declared_tests":["tests/speckit-pro/layer7-integration/dispatch-fixtures/22-prsg-014-stack-manager-replay/README.md","tests/speckit-pro/layer7-integration/dispatch-fixtures/22-prsg-014-stack-manager-replay/expected.json","tests/speckit-pro/layer7-integration/dispatch-fixtures/22-prsg-014-stack-manager-replay/parser-fixture.jsonl","tests/speckit-pro/layer7-integration/dispatch-fixtures/22-prsg-014-stack-manager-replay/prompt.txt","tests/speckit-pro/layer7-integration/run-all-fixtures.sh","tests/speckit-pro/layer7-integration/run-dispatch-fixtures.sh","tests/speckit-pro/layer8-parity/04-prsg-014-stack-manager-guidance/README.md","tests/speckit-pro/layer8-parity/04-prsg-014-stack-manager-guidance/env-fallback.sh","tests/speckit-pro/layer8-parity/04-prsg-014-stack-manager-guidance/env-teams.sh","tests/speckit-pro/layer8-parity/04-prsg-014-stack-manager-guidance/expected-equivalence.json","tests/speckit-pro/layer8-parity/04-prsg-014-stack-manager-guidance/tolerance.json","tests/speckit-pro/layer8-parity/04-prsg-014-stack-manager-guidance/workflow.md","tests/speckit-pro/layer8-parity/run-parity-fixtures.sh","tests/speckit-pro/run-all.sh"],"warnings":[]}]},"warnings":[{"code":"reviewability_size_warning","severity":"warning","message":"Reviewability sizing result is marker-planning input.","source":"reviewability","details":{"status":"block","mode":"tasks","evidence_path":"specs/prsg-014-optional-gh-stack-stack-manager-integration/.process/reviewability/tasks-gate.json"}},{"code":"FINAL_DIFF_SIZE_BLOCKED","severity":"warning","message":"Final diff is size-blocked, but the current marker plan is valid for scoped PR emission.","source":"final-reviewability-backstop","details":{"feature_dir":"specs/prsg-014-optional-gh-stack-stack-manager-integration"}}],"no_pr_assertions":{"pr_created":false,"pr":null,"pr_body_generated":false,"single_pr_create_invoked":false,"gh_pr_create_invoked":false,"multi_pr_emission_invoked":false}}
