{"schemaVersion":1,"kind":"final_reviewability_gate","status":"proceed","outcome":"marker_split","mode":"final","gate_result":"block","gate_reason":"total files 117 exceeds block threshold 25","metrics":{"reviewable_loc":0,"production_files":0,"total_files":117,"primary_surface_count":6,"primary_surfaces":["API","docs/process","other","scheduler/runtime","schema/migration","seed/config"],"greenfield":false,"thresholds":{"warn":{"reviewable_loc":400,"production_files":6,"total_files":15,"primary_surfaces":1},"block":{"reviewable_loc":800,"production_files":8,"total_files":25,"primary_surfaces":1}},"warnings":["total files 117 exceeds warn threshold 15","primary surfaces 6 exceeds warn threshold 1"],"blockers":["total files 117 exceeds block threshold 25"]},"exception":{"honored":false,"class":null,"evidence":[]},"blocked_operations":[],"timestamp":"2026-06-12T05:00:18Z","pr_created":false,"pr":null,"reslicing_packet_path":null,"marker_split_evidence_path":"docs/ai/specs/.process/PRSG-013-final-marker-split-result.json","full_diff":{"reviewability_status":"block","gate_exit_code":1,"reason":"total files 117 exceeds block threshold 25","metrics":{"reviewable_loc":0,"production_files":0,"total_files":117,"primary_surface_count":6,"primary_surfaces":["API","docs/process","other","scheduler/runtime","schema/migration","seed/config"],"greenfield":false,"thresholds":{"warn":{"reviewable_loc":400,"production_files":6,"total_files":15,"primary_surfaces":1},"block":{"reviewable_loc":800,"production_files":8,"total_files":25,"primary_surfaces":1}},"warnings":["total files 117 exceeds warn threshold 15","primary surfaces 6 exceeds warn threshold 1"],"blockers":["total files 117 exceeds block threshold 25"]},"evidence_path":"docs/ai/specs/.process/PRSG-013-final-reviewability-gate-result.json"},"marker_plan":{"valid":true,"fingerprint_matched":true,"marker_count":4,"marker_order":["foundation","us1","us2","us3"],"status":"emission_ready","evidence_path":"docs/ai/specs/.process/autopilot-state.json","source_fingerprint":{"feature_spec_sha":"8629d25719a70151e41e445a148bb37903fc766ef1433b9410c93eb139a3bae4","plan_declared_scope_sha":"98d68e68e51f14b8d5b78cd5c99f82ff26eaebdbd2410acdd4a3a8845afefd35","tasks_sha":"0e6ad0831c3824c156a784469e4d966867424dbfa4676c8bec0ccfa04f3ae6cd","reviewability_sha":"fa42c1fce8681232113dc108d91eb2e1cf5536b8fca895421fdd52dd4e05fcaa","hazard_route_sha":"d5501ebfc29e3f67f6df2e4f36615efe1784a6d353ebd151a90d111a55a2ce91"}},"emission":{"route":"marker_split","markers":[{"id":"foundation","review_order":1,"source_marker_ids":["foundation"],"packet_path":null,"declared_files":[{"operation":"MODIFIED","path":"speckit-pro/skills/speckit-autopilot/contracts/pr-marker-plan.schema.json"},{"operation":"MODIFIED","path":"speckit-pro/skills/speckit-autopilot/scripts/final-reviewability-backstop.sh"},{"operation":"MODIFIED","path":"speckit-pro/skills/speckit-autopilot/scripts/multi-pr-emission.sh"},{"operation":"MODIFIED","path":"speckit-pro/skills/speckit-autopilot/scripts/plan-layers.sh"},{"operation":"MODIFIED","path":"speckit-pro/skills/speckit-autopilot/scripts/reviewability-gate.sh"},{"operation":"MODIFIED","path":"specs/prsg-013-reviewability-markers/contracts/*.schema.json"},{"operation":"MODIFIED","path":"specs/prsg-013-reviewability-markers/contracts/pr-marker-plan.schema.json"}],"declared_tests":[],"warnings":[]},{"id":"us1","review_order":2,"source_marker_ids":["us1"],"packet_path":null,"declared_files":[{"operation":"MODIFIED","path":"speckit-pro/skills/speckit-autopilot/contracts/final-reviewability-gate-state.schema.json"},{"operation":"MODIFIED","path":"speckit-pro/skills/speckit-autopilot/references/gate-validation.md"},{"operation":"MODIFIED","path":"speckit-pro/skills/speckit-autopilot/references/phase-execution.md"},{"operation":"MODIFIED","path":"speckit-pro/skills/speckit-autopilot/scripts/final-reviewability-backstop.sh"}],"declared_tests":["tests/speckit-pro/layer4-scripts/test-final-reviewability-backstop.sh","tests/speckit-pro/layer4-scripts/test-plan-layers.sh"],"warnings":[]},{"id":"us2","review_order":3,"source_marker_ids":["us2"],"packet_path":null,"declared_files":[{"operation":"MODIFIED","path":"speckit-pro/skills/speckit-autopilot/SKILL.md"},{"operation":"MODIFIED","path":"speckit-pro/skills/speckit-autopilot/references/workflow-file-protocol.md"},{"operation":"MODIFIED","path":"speckit-pro/skills/speckit-autopilot/scripts/plan-layers.sh"}],"declared_tests":["tests/speckit-pro/layer4-scripts/test-plan-layers.sh"],"warnings":[]},{"id":"us3","review_order":4,"source_marker_ids":["us3"],"packet_path":null,"declared_files":[{"operation":"MODIFIED","path":"docs/ai/specs/.process/PRSG-013-workflow.md"},{"operation":"MODIFIED","path":"docs/ai/specs/.process/autopilot-state.json"},{"operation":"MODIFIED","path":"speckit-pro/codex-skills/speckit-autopilot/SKILL.md"},{"operation":"MODIFIED","path":"speckit-pro/codex-skills/speckit-autopilot/references/phase-execution-codex.md"},{"operation":"MODIFIED","path":"speckit-pro/codex-skills/speckit-autopilot/references/post-implementation-codex.md"},{"operation":"MODIFIED","path":"speckit-pro/skills/speckit-autopilot/contracts/*.schema.json"},{"operation":"MODIFIED","path":"speckit-pro/skills/speckit-autopilot/contracts/multi-pr-emission-state.schema.json"},{"operation":"MODIFIED","path":"speckit-pro/skills/speckit-autopilot/references/phase-execution.md"},{"operation":"MODIFIED","path":"speckit-pro/skills/speckit-autopilot/references/post-implementation.md"},{"operation":"MODIFIED","path":"speckit-pro/skills/speckit-autopilot/scripts/multi-pr-emission.sh"},{"operation":"MODIFIED","path":"specs/prsg-013-reviewability-markers/contracts/marker-split-result.schema.json"},{"operation":"MODIFIED","path":"specs/prsg-013-reviewability-markers/contracts/pr-marker-plan.schema.json"}],"declared_tests":["tests/speckit-pro/layer3-functional/codex-evals/speckit-autopilot-evals.json","tests/speckit-pro/layer3-functional/evals/speckit-autopilot-evals.json","tests/speckit-pro/layer4-scripts/test-multi-pr-emission.sh","tests/speckit-pro/run-all.sh"],"warnings":[]}]},"warnings":[{"code":"reviewability_size_warning","severity":"warning","message":"Reviewability sizing result is marker-planning input.","source":"reviewability","details":{"status":"block","mode":"tasks","evidence_path":"docs/ai/specs/.process/PRSG-013-reviewability-result.json"}},{"code":"FINAL_DIFF_SIZE_BLOCKED","severity":"warning","message":"Final diff is size-blocked, but the current marker plan is valid for scoped PR emission.","source":"final-reviewability-backstop","details":{"feature_dir":"specs/prsg-013-reviewability-markers"}}],"no_pr_assertions":{"pr_created":false,"pr":null,"pr_body_generated":false,"single_pr_create_invoked":false,"gh_pr_create_invoked":false,"multi_pr_emission_invoked":false}}
