{"schemaVersion":1,"kind":"final_reviewability_gate","status":"proceed","outcome":"marker_split","mode":"final","gate_result":"block","gate_reason":"total files 74 exceeds block threshold 25","metrics":{"reviewable_loc":0,"production_files":0,"total_files":74,"primary_surface_count":6,"primary_surfaces":["API","docs/process","other","scheduler/runtime","schema/migration","seed/config"],"greenfield":false,"thresholds":{"warn":{"reviewable_loc":400,"production_files":6,"total_files":15,"primary_surfaces":1},"block":{"reviewable_loc":800,"production_files":8,"total_files":25,"primary_surfaces":1}},"warnings":["total files 74 exceeds warn threshold 15","primary surfaces 6 exceeds warn threshold 1"],"blockers":["total files 74 exceeds block threshold 25"]},"exception":{"honored":false,"class":null,"evidence":[]},"blocked_operations":[],"timestamp":"2026-06-12T20:02:06Z","pr_created":false,"pr":null,"reslicing_packet_path":null,"marker_split_evidence_path":"specs/prsg-012-reviewer-ready-pr-packet-contract/.process/marker-plan/final-marker-split-result.json","full_diff":{"reviewability_status":"block","gate_exit_code":1,"reason":"total files 74 exceeds block threshold 25","metrics":{"reviewable_loc":0,"production_files":0,"total_files":74,"primary_surface_count":6,"primary_surfaces":["API","docs/process","other","scheduler/runtime","schema/migration","seed/config"],"greenfield":false,"thresholds":{"warn":{"reviewable_loc":400,"production_files":6,"total_files":15,"primary_surfaces":1},"block":{"reviewable_loc":800,"production_files":8,"total_files":25,"primary_surfaces":1}},"warnings":["total files 74 exceeds warn threshold 15","primary surfaces 6 exceeds warn threshold 1"],"blockers":["total files 74 exceeds block threshold 25"]},"evidence_path":"/var/folders/jp/nt5kjq_11m3fvxg9ftwjjqsw0000gn/T//final-reviewability-gate.UAnQTW"},"marker_plan":{"valid":true,"fingerprint_matched":true,"marker_count":5,"marker_order":["foundation","us1","us2","us3","us4"],"status":"emission_ready","evidence_path":"docs/ai/specs/.process/autopilot-state.json","source_fingerprint":{"feature_spec_sha":"2868f175a1317a76337610bc3d815dab6ccb3e11ae5ac7eb2441a7118d57ec63","plan_declared_scope_sha":"555c366e659bc1723e283d2b4d3c42a415950b0fae1b3639ae30f26bdc2f0056","tasks_sha":"51dde76432d2326bff72d6bbd86ce1451ebf39a35bd1ba2bc42f6f1047a5c9d7","reviewability_sha":"f440668daa09459968775005ef51c6ef32cddf58b37a335995edc99c035e8768","hazard_route_sha":"57eb0ef319cb1075f5cd033a12944e52fa59edaace2562f3692f4919b8ca9f23"}},"emission":{"route":"marker_split","markers":[{"id":"foundation","review_order":1,"source_marker_ids":["foundation"],"packet_path":null,"declared_files":[{"operation":"MODIFIED","path":"speckit-pro/skills/speckit-autopilot/contracts/pr-packet.schema.json"},{"operation":"MODIFIED","path":"speckit-pro/skills/speckit-autopilot/scripts/validate-pr-packet.sh"},{"operation":"MODIFIED","path":"specs/prsg-012-reviewer-ready-pr-packet-contract/tasks.md"}],"declared_tests":["tests/speckit-pro/layer4-scripts/fixtures/pr-packet/bodies/valid-single.md","tests/speckit-pro/layer4-scripts/fixtures/pr-packet/bodies/valid-split.md","tests/speckit-pro/layer4-scripts/fixtures/pr-packet/invalid-malformed-json.json","tests/speckit-pro/layer4-scripts/fixtures/pr-packet/invalid-missing-evidence.json","tests/speckit-pro/layer4-scripts/fixtures/pr-packet/invalid-title-token.json","tests/speckit-pro/layer4-scripts/fixtures/pr-packet/valid-single.json","tests/speckit-pro/layer4-scripts/fixtures/pr-packet/valid-split.json","tests/speckit-pro/layer4-scripts/test-generate-pr-body.sh","tests/speckit-pro/layer4-scripts/test-multi-pr-emission.sh","tests/speckit-pro/layer4-scripts/test-validate-pr-packet.sh"],"warnings":[]},{"id":"us1","review_order":2,"source_marker_ids":["us1"],"packet_path":null,"declared_files":[{"operation":"MODIFIED","path":"speckit-pro/skills/speckit-autopilot/references/post-implementation.md"},{"operation":"MODIFIED","path":"speckit-pro/skills/speckit-autopilot/scripts/generate-pr-body.sh"},{"operation":"MODIFIED","path":"speckit-pro/skills/speckit-autopilot/scripts/multi-pr-emission.sh"},{"operation":"MODIFIED","path":"speckit-pro/skills/speckit-autopilot/scripts/validate-pr-packet.sh"}],"declared_tests":["tests/speckit-pro/layer4-scripts/fixtures/pr-packet/invalid-title-token.json","tests/speckit-pro/layer4-scripts/test-generate-pr-body.sh","tests/speckit-pro/layer4-scripts/test-multi-pr-emission.sh"],"warnings":[]},{"id":"us2","review_order":3,"source_marker_ids":["us2"],"packet_path":null,"declared_files":[{"operation":"MODIFIED","path":"speckit-pro/skills/speckit-autopilot/scripts/generate-pr-body.sh"},{"operation":"MODIFIED","path":"speckit-pro/skills/speckit-autopilot/scripts/validate-pr-packet.sh"},{"operation":"MODIFIED","path":"speckit-pro/skills/speckit-autopilot/templates/pr-description-template.md"}],"declared_tests":["tests/speckit-pro/layer4-scripts/fixtures/pr-packet/bodies/valid-single.md","tests/speckit-pro/layer4-scripts/test-generate-pr-body.sh","tests/speckit-pro/layer4-scripts/test-validate-pr-packet.sh"],"warnings":[]},{"id":"us3","review_order":4,"source_marker_ids":["us3"],"packet_path":null,"declared_files":[{"operation":"MODIFIED","path":".process/prs.json"},{"operation":"MODIFIED","path":"docs/ai/specs/.process/PRSG-012-workflow.md"},{"operation":"MODIFIED","path":"speckit-pro/skills/speckit-autopilot/references/post-implementation.md"},{"operation":"MODIFIED","path":"speckit-pro/skills/speckit-autopilot/scripts/multi-pr-emission.sh"},{"operation":"MODIFIED","path":"speckit-pro/skills/speckit-autopilot/scripts/validate-pr-packet.sh"}],"declared_tests":["tests/speckit-pro/layer4-scripts/fixtures/pr-packet/invalid-missing-packet.args","tests/speckit-pro/layer4-scripts/fixtures/pr-packet/split-partial-failure-state.json","tests/speckit-pro/layer4-scripts/test-multi-pr-emission.sh","tests/speckit-pro/layer4-scripts/test-validate-pr-packet.sh"],"warnings":[]},{"id":"us4","review_order":5,"source_marker_ids":["us4"],"packet_path":null,"declared_files":[{"operation":"MODIFIED","path":"speckit-pro/codex-skills/speckit-autopilot/SKILL.md"},{"operation":"MODIFIED","path":"speckit-pro/codex-skills/speckit-autopilot/references/post-implementation-codex.md"},{"operation":"MODIFIED","path":"speckit-pro/skills/speckit-autopilot/SKILL.md"},{"operation":"MODIFIED","path":"speckit-pro/skills/speckit-autopilot/references/post-implementation.md"},{"operation":"MODIFIED","path":"speckit-pro/skills/speckit-autopilot/scripts/generate-pr-body.sh"},{"operation":"MODIFIED","path":"speckit-pro/skills/speckit-autopilot/scripts/validate-pr-packet.sh"}],"declared_tests":["tests/speckit-pro/layer3-functional/codex-evals/speckit-autopilot-evals.json","tests/speckit-pro/layer3-functional/evals/speckit-autopilot-evals.json","tests/speckit-pro/layer4-scripts/fixtures/pr-packet/bodies/valid-single-edited.md","tests/speckit-pro/layer4-scripts/fixtures/pr-packet/invalid-protected-edit.json","tests/speckit-pro/layer4-scripts/test-validate-pr-packet.sh","tests/speckit-pro/layer7-integration/dispatch-fixtures/18-post-impl-parallel-subagents/README.md","tests/speckit-pro/layer7-integration/dispatch-fixtures/18-post-impl-parallel-subagents/expected.json","tests/speckit-pro/layer7-integration/dispatch-fixtures/18-post-impl-parallel-subagents/parser-fixture.jsonl","tests/speckit-pro/layer7-integration/dispatch-fixtures/18-post-impl-parallel-subagents/prompt.txt","tests/speckit-pro/layer8-parity/01-post-impl-parity/README.md","tests/speckit-pro/layer8-parity/01-post-impl-parity/expected-equivalence.json","tests/speckit-pro/layer8-parity/01-post-impl-parity/tolerance.json","tests/speckit-pro/layer8-parity/01-post-impl-parity/workflow.md","tests/speckit-pro/run-all.sh"],"warnings":[]}]},"warnings":[{"code":"reviewability_size_warning","severity":"warning","message":"Reviewability sizing result is marker-planning input.","source":"reviewability","details":{"status":"block","mode":"tasks","evidence_path":"specs/prsg-012-reviewer-ready-pr-packet-contract/.process/reviewability/tasks-gate.json"}},{"code":"FINAL_DIFF_SIZE_BLOCKED","severity":"warning","message":"Final diff is size-blocked, but the current marker plan is valid for scoped PR emission.","source":"final-reviewability-backstop","details":{"feature_dir":"specs/prsg-012-reviewer-ready-pr-packet-contract"}}],"no_pr_assertions":{"pr_created":false,"pr":null,"pr_body_generated":false,"single_pr_create_invoked":false,"gh_pr_create_invoked":false,"multi_pr_emission_invoked":false}}
