{"schemaVersion":1,"kind":"final_reviewability_gate","status":"proceed","outcome":"marker_split","mode":"final","gate_result":"block","gate_reason":"total files 52 exceeds block threshold 25","metrics":{"reviewable_loc":0,"production_files":0,"total_files":52,"primary_surface_count":4,"primary_surfaces":["API","docs/process","scheduler/runtime","seed/config"],"greenfield":false,"thresholds":{"warn":{"reviewable_loc":400,"production_files":6,"total_files":15,"primary_surfaces":1},"block":{"reviewable_loc":800,"production_files":8,"total_files":25,"primary_surfaces":1}},"warnings":["total files 52 exceeds warn threshold 15","primary surfaces 4 exceeds warn threshold 1"],"blockers":["total files 52 exceeds block threshold 25"]},"exception":{"honored":false,"class":null,"evidence":[]},"blocked_operations":[],"timestamp":"2026-06-18T05:28:45Z","pr_created":false,"pr":null,"reslicing_packet_path":null,"marker_split_evidence_path":"specs/tacd-002-capability-discovery-directive-and-agent-updates/.process/marker-plan/final-marker-split-result.json","full_diff":{"reviewability_status":"block","gate_exit_code":1,"reason":"total files 52 exceeds block threshold 25","metrics":{"reviewable_loc":0,"production_files":0,"total_files":52,"primary_surface_count":4,"primary_surfaces":["API","docs/process","scheduler/runtime","seed/config"],"greenfield":false,"thresholds":{"warn":{"reviewable_loc":400,"production_files":6,"total_files":15,"primary_surfaces":1},"block":{"reviewable_loc":800,"production_files":8,"total_files":25,"primary_surfaces":1}},"warnings":["total files 52 exceeds warn threshold 15","primary surfaces 4 exceeds warn threshold 1"],"blockers":["total files 52 exceeds block threshold 25"]},"evidence_path":"specs/tacd-002-capability-discovery-directive-and-agent-updates/.process/final-reviewability/gate-state.json"},"marker_plan":{"valid":true,"fingerprint_matched":true,"marker_count":5,"marker_order":["foundation","us1","us2","us3","us4"],"status":"emission_ready","evidence_path":"docs/ai/specs/.process/autopilot-state.json","source_fingerprint":{"feature_spec_sha":"ce2cf5e5c665b538dd315239f9b0bedea541162476260b2ff013f53e05d71f77","plan_declared_scope_sha":"927e865548d61303f08327424edc535397cb836f937c314769440bbd02b8e7d8","tasks_sha":"6ca9726672d0e235bec1d3bc7b4335f34a043eb1549f711afebd692381e66764","reviewability_sha":"7bb38e26bf4c7b95b787b8db931e973a828fb1ae494ce14c65788ac7d436d6bb","hazard_route_sha":"5ec383c17e5e7102cc97e81882f023da85a301abb73f39023ddea31b24e349f0"}},"emission":{"route":"marker_split","markers":[{"id":"foundation","review_order":1,"source_marker_ids":["foundation"],"packet_path":null,"declared_files":[{"operation":"MODIFIED","path":"docs/ai/specs/.process/TACD-002-design-concept.md"},{"operation":"MODIFIED","path":"speckit-pro/skills/speckit-autopilot/references/capability-discovery.md"},{"operation":"MODIFIED","path":"speckit-pro/skills/speckit-autopilot/references/consensus-protocol.md"},{"operation":"MODIFIED","path":"speckit-pro/skills/speckit-autopilot/references/gate-validation.md"},{"operation":"MODIFIED","path":"specs/tacd-002-capability-discovery-directive-and-agent-updates/contracts/capability-discovery-guidance.md"},{"operation":"MODIFIED","path":"specs/tacd-002-capability-discovery-directive-and-agent-updates/plan.md"},{"operation":"MODIFIED","path":"specs/tacd-002-capability-discovery-directive-and-agent-updates/quickstart.md"},{"operation":"MODIFIED","path":"specs/tacd-002-capability-discovery-directive-and-agent-updates/spec.md"}],"declared_tests":[],"warnings":[]},{"id":"us1","review_order":2,"source_marker_ids":["us1"],"packet_path":null,"declared_files":[{"operation":"MODIFIED","path":"speckit-pro/agents/analyze-executor.md"},{"operation":"MODIFIED","path":"speckit-pro/agents/checklist-executor.md"},{"operation":"MODIFIED","path":"speckit-pro/agents/clarify-executor.md"},{"operation":"MODIFIED","path":"speckit-pro/agents/codebase-analyst.md"},{"operation":"MODIFIED","path":"speckit-pro/agents/domain-researcher.md"},{"operation":"MODIFIED","path":"speckit-pro/agents/implement-executor.md"},{"operation":"MODIFIED","path":"speckit-pro/codex-agents/analyze-executor.toml"},{"operation":"MODIFIED","path":"speckit-pro/codex-agents/checklist-executor.toml"},{"operation":"MODIFIED","path":"speckit-pro/codex-agents/clarify-executor.toml"},{"operation":"MODIFIED","path":"speckit-pro/codex-agents/codebase-analyst.toml"},{"operation":"MODIFIED","path":"speckit-pro/codex-agents/domain-researcher.toml"},{"operation":"MODIFIED","path":"speckit-pro/codex-agents/implement-executor.toml"},{"operation":"MODIFIED","path":"speckit-pro/skills/speckit-autopilot/references/consensus-protocol.md"},{"operation":"MODIFIED","path":"speckit-pro/skills/speckit-autopilot/references/gate-validation.md"}],"declared_tests":[],"warnings":[]},{"id":"us2","review_order":3,"source_marker_ids":["us2"],"packet_path":null,"declared_files":[{"operation":"MODIFIED","path":"speckit-pro/agents/analyze-executor.md"},{"operation":"MODIFIED","path":"speckit-pro/agents/checklist-executor.md"},{"operation":"MODIFIED","path":"speckit-pro/agents/clarify-executor.md"},{"operation":"MODIFIED","path":"speckit-pro/agents/codebase-analyst.md"},{"operation":"MODIFIED","path":"speckit-pro/agents/domain-researcher.md"},{"operation":"MODIFIED","path":"speckit-pro/agents/implement-executor.md"},{"operation":"MODIFIED","path":"speckit-pro/codex-agents/analyze-executor.toml"},{"operation":"MODIFIED","path":"speckit-pro/codex-agents/checklist-executor.toml"},{"operation":"MODIFIED","path":"speckit-pro/codex-agents/clarify-executor.toml"},{"operation":"MODIFIED","path":"speckit-pro/codex-agents/codebase-analyst.toml"},{"operation":"MODIFIED","path":"speckit-pro/codex-agents/domain-researcher.toml"},{"operation":"MODIFIED","path":"speckit-pro/codex-agents/implement-executor.toml"},{"operation":"MODIFIED","path":"speckit-pro/skills/speckit-autopilot/references/capability-discovery.md"},{"operation":"MODIFIED","path":"specs/tacd-002-capability-discovery-directive-and-agent-updates/contracts/capability-discovery-guidance.md"}],"declared_tests":[],"warnings":[]},{"id":"us3","review_order":4,"source_marker_ids":["us3"],"packet_path":null,"declared_files":[{"operation":"MODIFIED","path":"speckit-pro/agents/*.md"},{"operation":"MODIFIED","path":"speckit-pro/agents/analyze-executor.md"},{"operation":"MODIFIED","path":"speckit-pro/agents/checklist-executor.md"},{"operation":"MODIFIED","path":"speckit-pro/agents/clarify-executor.md"},{"operation":"MODIFIED","path":"speckit-pro/agents/codebase-analyst.md"},{"operation":"MODIFIED","path":"speckit-pro/agents/domain-researcher.md"},{"operation":"MODIFIED","path":"speckit-pro/agents/implement-executor.md"},{"operation":"MODIFIED","path":"speckit-pro/codex-agents/*.toml"},{"operation":"MODIFIED","path":"speckit-pro/codex-agents/analyze-executor.toml"},{"operation":"MODIFIED","path":"speckit-pro/codex-agents/checklist-executor.toml"},{"operation":"MODIFIED","path":"speckit-pro/codex-agents/clarify-executor.toml"},{"operation":"MODIFIED","path":"speckit-pro/codex-agents/codebase-analyst.toml"},{"operation":"MODIFIED","path":"speckit-pro/codex-agents/domain-researcher.toml"},{"operation":"MODIFIED","path":"speckit-pro/codex-agents/implement-executor.toml"},{"operation":"MODIFIED","path":"speckit-pro/codex-skills/speckit-autopilot/agents/openai.yaml"},{"operation":"MODIFIED","path":"speckit-pro/skills/speckit-autopilot/references/capability-discovery.md"}],"declared_tests":[],"warnings":[]},{"id":"us4","review_order":5,"source_marker_ids":["us4"],"packet_path":null,"declared_files":[{"operation":"MODIFIED","path":"dist/claude/speckit-pro/skills/speckit-autopilot/references/capability-discovery.md"},{"operation":"MODIFIED","path":"dist/codex/speckit-pro/skills/speckit-autopilot/references/capability-discovery.md"},{"operation":"MODIFIED","path":"scripts/build-plugin-payloads.sh"},{"operation":"MODIFIED","path":"specs/tacd-002-capability-discovery-directive-and-agent-updates/checklists/error-handling.md"},{"operation":"MODIFIED","path":"specs/tacd-002-capability-discovery-directive-and-agent-updates/checklists/integration.md"},{"operation":"MODIFIED","path":"specs/tacd-002-capability-discovery-directive-and-agent-updates/checklists/llm-integration.md"},{"operation":"MODIFIED","path":"specs/tacd-002-capability-discovery-directive-and-agent-updates/plan.md"},{"operation":"MODIFIED","path":"specs/tacd-002-capability-discovery-directive-and-agent-updates/spec.md"}],"declared_tests":["tests/speckit-pro/run-all.sh"],"warnings":[]}]},"warnings":[{"code":"reviewability_size_warning","severity":"warning","message":"Reviewability sizing result is marker-planning input.","source":"reviewability","details":{"status":"block","mode":"tasks","evidence_path":"specs/tacd-002-capability-discovery-directive-and-agent-updates/.process/reviewability/task-gate.json"}},{"code":"FINAL_DIFF_SIZE_BLOCKED","severity":"warning","message":"Final diff is size-blocked, but the current marker plan is valid for scoped PR emission.","source":"final-reviewability-backstop","details":{"feature_dir":"specs/tacd-002-capability-discovery-directive-and-agent-updates"}}],"no_pr_assertions":{"pr_created":false,"pr":null,"pr_body_generated":false,"single_pr_create_invoked":false,"gh_pr_create_invoked":false,"multi_pr_emission_invoked":false}}