{"schemaVersion":1,"kind":"final_reviewability_gate","status":"proceed","outcome":"marker_split","mode":"final","gate_result":"block","gate_reason":"total files 32 exceeds block threshold 25","metrics":{"reviewable_loc":0,"production_files":0,"total_files":32,"primary_surface_count":3,"primary_surfaces":["docs/process","scheduler/runtime","seed/config"],"greenfield":false,"thresholds":{"warn":{"reviewable_loc":400,"production_files":6,"total_files":15,"primary_surfaces":1},"block":{"reviewable_loc":800,"production_files":8,"total_files":25,"primary_surfaces":1}},"warnings":["total files 32 exceeds warn threshold 15","primary surfaces 3 exceeds warn threshold 1"],"blockers":["total files 32 exceeds block threshold 25"]},"exception":{"honored":false,"class":null,"evidence":[]},"blocked_operations":[],"timestamp":"2026-06-12T22:27:11Z","pr_created":false,"pr":null,"reslicing_packet_path":null,"marker_split_evidence_path":"specs/doc-001-static-docs-framework-and-ia-spike/.process/marker-plan/final-marker-split-result.json","full_diff":{"reviewability_status":"block","gate_exit_code":1,"reason":"total files 32 exceeds block threshold 25","metrics":{"reviewable_loc":0,"production_files":0,"total_files":32,"primary_surface_count":3,"primary_surfaces":["docs/process","scheduler/runtime","seed/config"],"greenfield":false,"thresholds":{"warn":{"reviewable_loc":400,"production_files":6,"total_files":15,"primary_surfaces":1},"block":{"reviewable_loc":800,"production_files":8,"total_files":25,"primary_surfaces":1}},"warnings":["total files 32 exceeds warn threshold 15","primary surfaces 3 exceeds warn threshold 1"],"blockers":["total files 32 exceeds block threshold 25"]},"evidence_path":"/var/folders/jp/nt5kjq_11m3fvxg9ftwjjqsw0000gn/T//final-reviewability-gate.wfZw5P"},"marker_plan":{"valid":true,"fingerprint_matched":true,"marker_count":4,"marker_order":["foundation","us1","us2","us3"],"status":"emission_ready","evidence_path":"docs/ai/specs/.process/autopilot-state.json","source_fingerprint":{"feature_spec_sha":"106a2c8d3564561a85ebdb9077908b7d5af86b1fa48be36e5d1a9630f82a8881","plan_declared_scope_sha":"bc47711664f7de4ec246a62cf3e4d9446002b6d9db267e2d48b9609f8adac694","tasks_sha":"e395c4924a8f5a8b5ed225720d4d0be8421f84531f28b85302b5fa2fef465b0f","reviewability_sha":"11d3a54c6828f96a4249c369aefdfad9990acd995be07f403abdfdadc4f2048e","hazard_route_sha":"5ec383c17e5e7102cc97e81882f023da85a301abb73f39023ddea31b24e349f0"}},"emission":{"route":"marker_split","markers":[{"id":"foundation","review_order":1,"source_marker_ids":["foundation"],"packet_path":null,"declared_files":[{"operation":"MODIFIED","path":"docs/ai/research/interactive-documentation-framework-spike.md"},{"operation":"MODIFIED","path":"docs/ai/specs/.process/DOC-001-design-concept.md"},{"operation":"MODIFIED","path":"docs/prd-interactive-documentation.md"},{"operation":"MODIFIED","path":"docs/roadmap-interactive-documentation.md"},{"operation":"MODIFIED","path":"specs/doc-001-static-docs-framework-and-ia-spike/spec.md"}],"declared_tests":[],"warnings":[]},{"id":"us1","review_order":2,"source_marker_ids":["us1"],"packet_path":null,"declared_files":[{"operation":"MODIFIED","path":"docs/ai/research/interactive-documentation-framework-spike.md"}],"declared_tests":[],"warnings":[]},{"id":"us2","review_order":3,"source_marker_ids":["us2"],"packet_path":null,"declared_files":[{"operation":"MODIFIED","path":"docs/ai/research/interactive-documentation-framework-spike.md"}],"declared_tests":[],"warnings":[]},{"id":"us3","review_order":4,"source_marker_ids":["us3"],"packet_path":null,"declared_files":[{"operation":"MODIFIED","path":"docs/ai/research/interactive-documentation-framework-spike.md"}],"declared_tests":["tests/speckit-pro/run-all.sh"],"warnings":[]}]},"warnings":[{"code":"reviewability_size_warning","severity":"warning","message":"Reviewability sizing result is marker-planning input.","source":"reviewability","details":{"status":"block","mode":"tasks","evidence_path":""}},{"code":"FINAL_DIFF_SIZE_BLOCKED","severity":"warning","message":"Final diff is size-blocked, but the current marker plan is valid for scoped PR emission.","source":"final-reviewability-backstop","details":{"feature_dir":"specs/doc-001-static-docs-framework-and-ia-spike"}},{"code":"DOC001_PROCESS_SURFACE_NOTE","severity":"info","message":"Reviewability primary_surfaces classify process artifacts only; forbidden-surface scans confirm DOC-001 did not touch package, lockfile, site config, CI, generated payload, README migration, or plugin behavior files.","source":"doc-001-consistency-review","details":{"feature_dir":"specs/doc-001-static-docs-framework-and-ia-spike"}}],"no_pr_assertions":{"pr_created":false,"pr":null,"pr_body_generated":false,"single_pr_create_invoked":false,"gh_pr_create_invoked":false,"multi_pr_emission_invoked":false}}
