{"schemaVersion":1,"kind":"final_reviewability_gate","status":"warn","gate_result":"warn","gate_reason":"total files 20 exceeds warn threshold 15; primary surfaces 3 exceeds warn threshold 1","metrics":{"reviewable_loc":0,"production_files":0,"total_files":20,"primary_surface_count":3,"primary_surfaces":["docs/process","scheduler/runtime","seed/config"],"greenfield":false,"thresholds":{"warn":{"reviewable_loc":400,"production_files":6,"total_files":15,"primary_surfaces":1},"block":{"reviewable_loc":800,"production_files":8,"total_files":25,"primary_surfaces":1}},"warnings":["total files 20 exceeds warn threshold 15","primary surfaces 3 exceeds warn threshold 1"],"blockers":[]},"exception":{"honored":false,"class":null,"evidence":[]},"blocked_operations":[],"timestamp":"2026-06-26T00:16:55Z","pr_created":false,"pr":null,"reslicing_packet_path":null,"full_diff":{"reviewability_status":"block","gate_exit_code":1,"reason":"total files 33 exceeds block threshold 25","metrics":{"reviewable_loc":0,"production_files":0,"total_files":33,"primary_surface_count":4,"primary_surfaces":["docs/process","other","scheduler/runtime","seed/config"],"greenfield":false,"thresholds":{"warn":{"reviewable_loc":400,"production_files":6,"total_files":15,"primary_surfaces":1},"block":{"reviewable_loc":800,"production_files":8,"total_files":25,"primary_surfaces":1}},"warnings":["total files 33 exceeds warn threshold 15","primary surfaces 4 exceeds warn threshold 1"],"blockers":["total files 33 exceeds block threshold 25"]},"evidence_path":"speckit-pro/skills/speckit-autopilot/scripts/reviewability-gate.sh diff main"}}
