{
  "schemaVersion": 1,
  "kind": "final_reviewability_gate",
  "status": "proceed",
  "outcome": "marker_split",
  "mode": "final",
  "gate_result": "block",
  "gate_reason": "reviewable LOC 846 exceeds block threshold 800",
  "metrics": {
    "reviewable_loc": 846,
    "production_files": 2,
    "total_files": 25,
    "primary_surface_count": 5,
    "primary_surfaces": [
      "docs/process",
      "other",
      "scheduler/runtime",
      "schema/migration",
      "seed/config"
    ],
    "greenfield": false,
    "thresholds": {
      "warn": {
        "reviewable_loc": 400,
        "production_files": 6,
        "total_files": 15,
        "primary_surfaces": 1
      },
      "block": {
        "reviewable_loc": 800,
        "production_files": 8,
        "total_files": 25,
        "primary_surfaces": 1
      }
    },
    "warnings": [
      "reviewable LOC 846 exceeds warn threshold 400",
      "total files 25 exceeds warn threshold 15",
      "primary surfaces 5 exceeds warn threshold 1"
    ],
    "blockers": [
      "reviewable LOC 846 exceeds block threshold 800"
    ]
  },
  "exception": {
    "honored": false,
    "class": null,
    "evidence": []
  },
  "blocked_operations": [],
  "timestamp": "2026-06-17T04:32:08Z",
  "pr_created": false,
  "pr": null,
  "reslicing_packet_path": null,
  "marker_split_evidence_path": "specs/doc-006-safe-interactive-selector-and-validation-aids/.process/marker-plan/final-marker-split-result.json",
  "full_diff": {
    "reviewability_status": "block",
    "gate_exit_code": 1,
    "reason": "reviewable LOC 846 exceeds block threshold 800",
    "metrics": {
      "reviewable_loc": 846,
      "production_files": 2,
      "total_files": 25,
      "primary_surface_count": 5,
      "primary_surfaces": [
        "docs/process",
        "other",
        "scheduler/runtime",
        "schema/migration",
        "seed/config"
      ],
      "greenfield": false,
      "thresholds": {
        "warn": {
          "reviewable_loc": 400,
          "production_files": 6,
          "total_files": 15,
          "primary_surfaces": 1
        },
        "block": {
          "reviewable_loc": 800,
          "production_files": 8,
          "total_files": 25,
          "primary_surfaces": 1
        }
      },
      "warnings": [
        "reviewable LOC 846 exceeds warn threshold 400",
        "total files 25 exceeds warn threshold 15",
        "primary surfaces 5 exceeds warn threshold 1"
      ],
      "blockers": [
        "reviewable LOC 846 exceeds block threshold 800"
      ]
    },
    "evidence_path": "transient-final-reviewability-gate-output"
  },
  "marker_plan": {
    "valid": true,
    "fingerprint_matched": true,
    "marker_count": 4,
    "marker_order": [
      "foundation",
      "us1",
      "us2",
      "us3"
    ],
    "status": "emission_ready",
    "evidence_path": "specs/doc-006-safe-interactive-selector-and-validation-aids/.process/marker-plan/pr-marker-plan.json",
    "source_fingerprint": {
      "feature_spec_sha": "4358585ffd5ea393f471b35181a3ee9b6925e017d1f3586e01d43138af3fb439",
      "plan_declared_scope_sha": "54b4f1c98e8feb835be4efe0473588d91224bc6b4e9997d0f771ca9ac03a73d4",
      "tasks_sha": "c95a306b0c0a4c0a04f2610de1318344d2c60c0f60a72bbb8172c162f7e97184",
      "reviewability_sha": "a9f38ca15edfcff31d113915900962177b6280e6f97682be8425d7a48aa2209e",
      "hazard_route_sha": "d5501ebfc29e3f67f6df2e4f36615efe1784a6d353ebd151a90d111a55a2ce91"
    }
  },
  "emission": {
    "route": "hazard_collapsed",
    "markers": [
      {
        "id": "full-spec",
        "review_order": 1,
        "source_marker_ids": [
          "foundation",
          "us1",
          "us2",
          "us3"
        ],
        "packet_path": "specs/doc-006-safe-interactive-selector-and-validation-aids/.process/pr-packet.json",
        "declared_files": [
          {
            "operation": "MODIFIED",
            "path": ".agents/plugins/marketplace.json"
          },
          {
            "operation": "MODIFIED",
            "path": ".claude-plugin/marketplace.json"
          },
          {
            "operation": "MODIFIED",
            "path": "dist/claude/speckit-pro/.claude-plugin/plugin.json"
          },
          {
            "operation": "MODIFIED",
            "path": "dist/codex/speckit-pro/.codex-plugin/plugin.json"
          },
          {
            "operation": "MODIFIED",
            "path": "docs-site/scripts/validate-doc006-safe-aids.mjs"
          },
          {
            "operation": "MODIFIED",
            "path": "docs-site/src/components/SafeInstallAids.astro"
          },
          {
            "operation": "MODIFIED",
            "path": "docs-site/src/content/docs/choose-your-path.md"
          },
          {
            "operation": "MODIFIED",
            "path": "docs-site/src/content/docs/choose-your-path.mdx"
          },
          {
            "operation": "MODIFIED",
            "path": "docs-site/src/data/safe-install-aids.ts"
          },
          {
            "operation": "MODIFIED",
            "path": "speckit-pro/.claude-plugin/plugin.json"
          },
          {
            "operation": "MODIFIED",
            "path": "speckit-pro/.codex-plugin/plugin.json"
          },
          {
            "operation": "MODIFIED",
            "path": "specs/doc-006-safe-interactive-selector-and-validation-aids/quickstart.md"
          },
          {
            "operation": "MODIFIED",
            "path": "specs/doc-006-safe-interactive-selector-and-validation-aids/spec.md"
          },
          {
            "operation": "MODIFIED",
            "path": "specs/doc-006-safe-interactive-selector-and-validation-aids/tasks.md"
          }
        ],
        "declared_tests": [],
        "warnings": [
          {
            "code": "HAZARD_COLLAPSE",
            "severity": "warning",
            "message": "Marker checkpoints collapsed to one completed implementation state; live split emission would create unsafe duplicate or empty slice branches, so this run uses one aggregate PR with marker evidence retained for review.",
            "source": "marker-checkpoints",
            "details": {
              "route": "one-navigable-PR",
              "releasable": false
            }
          }
        ]
      }
    ]
  },
  "warnings": [
    {
      "code": "reviewability_size_warning",
      "severity": "warning",
      "message": "Reviewability sizing result is marker-planning input.",
      "source": "reviewability",
      "details": {
        "status": "block",
        "mode": "tasks",
        "evidence_path": "specs/doc-006-safe-interactive-selector-and-validation-aids/.process/reviewability/tasks-gate-result.json"
      }
    },
    {
      "code": "FINAL_DIFF_SIZE_BLOCKED",
      "severity": "warning",
      "message": "Final diff is size-blocked, but the current marker plan is valid for scoped PR emission.",
      "source": "final-reviewability-backstop",
      "details": {
        "feature_dir": "specs/doc-006-safe-interactive-selector-and-validation-aids"
      }
    },
    {
      "code": "HAZARD_COLLAPSE",
      "severity": "warning",
      "message": "Marker checkpoints collapsed to one completed implementation state; live split emission would create unsafe duplicate or empty slice branches, so this run uses one aggregate PR with marker evidence retained for review.",
      "source": "marker-checkpoints",
      "details": {
        "route": "one-navigable-PR",
        "releasable": false
      }
    }
  ],
  "no_pr_assertions": {
    "pr_created": false,
    "pr": null,
    "pr_body_generated": false,
    "single_pr_create_invoked": false,
    "gh_pr_create_invoked": false,
    "multi_pr_emission_invoked": false
  }
}
